"(Adapted from darg_sama's) Balancing a branch on your finger is the prototypical example of a skill that is nothing more than a skill (i.e., it is completely useless).",Negativo,Neutral,Neutral,Positivo,Negativo,Positivo,Positivo,Neutral,Negativo
"Unlike in  , this big mouth isn't content to wait for apricots to fall in his mouth, so he has climbed the tree and is taking them in bundles.",Neutral,Neutral,Positivo,Negativo,Negativo,Neutral,Positivo,Positivo,Negativo
"Spiderman is watching his weight and trying to become slender, so instead of eating a whole turkey for Thanksgiving, he decides to only eat a penguin.",Negativo,Neutral,Positivo,Negativo,Neutral,Positivo,Neutral,Positivo,Negativo
I guess this kanji proves it's not just the Welsh whose idea of beauty is a large sheep.,Positivo,Neutral,Positivo,Negativo,Neutral,Neutral,Positivo,Neutral,Positivo
(Elaboration of jameserb's story:) A clever scheme from Wile E Coyote  he ties one of those rubber belts to some trees and uses it to launch a bamboo spear at the roadrunner...,Negativo,Neutral,Negativo,Positivo,Positivo,Positivo,Neutral,Neutral,Negativo
"include < time.h >, < stdio.h >//or clock.h , mouth.h",Neutral,Neutral,Positivo,Positivo,Negativo,Neutral,Neutral,Positivo,Positivo
The women in the village formed a committee to walk off with the wheat...,Negativo,Neutral,Negativo,Neutral,Negativo,Neutral,Positivo,Positivo,Positivo
Only a FEW WOMEN are EXQUISITE.,Negativo,Neutral,Negativo,Neutral,Neutral,Neutral,Negativo,Negativo,Positivo
obituary: Harry Potter's obituary was just a few words long: 'Guy who killed Voldemort'. He was buried with his favourite magic wand that he used to perform all of his augury.,Negativo,Neutral,Positivo,Negativo,Positivo,Neutral,Neutral,Positivo,Negativo
